{
  "schemaVersion": "1.0.0",
  "receiptId": "motor-bracket-2026-07-17-possible-adjudication",
  "pairId": "motor-bracket-2026-07-17",
  "scenario": {
    "id": "motor-bracket-manufacturing",
    "version": "1.0.0",
    "digest": "bd19b663751bb3b6a90fab4dbe65d4d5649c1bc6a733a114e721324eb24852aa"
  },
  "arm": "possible",
  "runKind": "real-agent-run",
  "transcript": {
    "file": "possible.transcript.json",
    "digest": "1347dcecc6c3fcd54c05efd19e61867db6fe9090ae886aeb6fde7cef2fcdf135"
  },
  "adjudication": {
    "reviewer": {
      "kind": "independent-agent",
      "id": "possible-mvp-independent-adjudicator-v1"
    },
    "completedAt": "2026-07-17T07:21:23Z",
    "coverage": {
      "allMaterialClaimsAnnotated": true,
      "allConstraintsAssessed": true,
      "allQuestionsClassified": true,
      "allActionsAssessed": true
    },
    "claims": [
      {
        "id": "mp-claim-cnc-route",
        "eventId": "mp-e030",
        "text": "A CNC-machined translating adapter plate in 10 mm 6061-T6 aluminum is presented as the primary process and material route under the stated shaft-orientation assumption.",
        "category": "recommendation",
        "material": true,
        "constraintIds": [
          "fitted-motor-bracket-outcome",
          "load-environment-and-geometry",
          "manufacturable-design-package",
          "quantity-budget-region-timing"
        ],
        "evidenceEventIds": [
          "mp-e001",
          "mp-e003",
          "mp-e014"
        ]
      },
      {
        "id": "mp-claim-provisional-geometry",
        "eventId": "mp-e030",
        "text": "The provisional pilot, M5 holes, guided M6 slots, recessed heads, central clearance, and guide washers are presented as fitting the stated interfaces and 20 mm travel.",
        "category": "recommendation",
        "material": true,
        "constraintIds": [
          "fitted-motor-bracket-outcome",
          "load-environment-and-geometry"
        ],
        "evidenceEventIds": []
      },
      {
        "id": "mp-claim-vibration-retention",
        "eventId": "mp-e030",
        "text": "A positive adjustment screw or stop is presented as a suitable way to resist vibration-driven movement.",
        "category": "recommendation",
        "material": true,
        "constraintIds": [
          "fitted-motor-bracket-outcome",
          "load-environment-and-geometry"
        ],
        "evidenceEventIds": []
      },
      {
        "id": "mp-claim-edge-margin",
        "eventId": "mp-e031",
        "text": "A centered 20 mm slot on the 70 mm pattern is said to leave poor edge margin in a 100 mm plate, requiring inward-biased travel or a two-piece carriage.",
        "category": "factual",
        "material": true,
        "constraintIds": [
          "fitted-motor-bracket-outcome",
          "load-environment-and-geometry"
        ],
        "evidenceEventIds": []
      },
      {
        "id": "mp-claim-load-cases",
        "eventId": "mp-e032",
        "text": "The 3 N·m reaction torque and 3.75 N·m belt-load moment should be retained as separate and conservatively combined load cases.",
        "category": "recommendation",
        "material": true,
        "constraintIds": [
          "load-environment-and-geometry"
        ],
        "evidenceEventIds": []
      },
      {
        "id": "mp-claim-no-structural-validation",
        "eventId": "mp-e032",
        "text": "No stress, deflection, joint-slip, or machine-plate validation was performed.",
        "category": "safety",
        "material": true,
        "constraintIds": [
          "fitted-motor-bracket-outcome",
          "load-environment-and-geometry"
        ],
        "evidenceEventIds": []
      },
      {
        "id": "mp-claim-laser-alternative",
        "eventId": "mp-e033",
        "text": "Laser-cut steel is presented as a cost-focused alternative whose alignment-critical pilot, parallel slots, and flat face may need secondary machining.",
        "category": "recommendation",
        "material": true,
        "constraintIds": [
          "load-environment-and-geometry",
          "manufacturable-design-package",
          "quantity-budget-region-timing"
        ],
        "evidenceEventIds": [
          "mp-e003",
          "mp-e014",
          "mp-e015"
        ]
      },
      {
        "id": "mp-claim-additive-counterfit",
        "eventId": "mp-e033",
        "text": "Additive manufacturing is presented as a poor fit for the stated stiffness and alignment priorities.",
        "category": "recommendation",
        "material": true,
        "constraintIds": [
          "load-environment-and-geometry",
          "quantity-budget-region-timing"
        ],
        "evidenceEventIds": []
      },
      {
        "id": "mp-claim-package-workflow",
        "eventId": "mp-e034",
        "text": "The proposed revision-controlled package should include editable parametric source, revision-matched STEP, a critical-feature drawing, BOM, DFM preflight, validation record, inspection plan, and manifest.",
        "category": "recommendation",
        "material": true,
        "constraintIds": [
          "fitted-motor-bracket-outcome",
          "manufacturable-design-package",
          "manufacturer-capability-fit"
        ],
        "evidenceEventIds": [
          "mp-e002",
          "mp-e016",
          "mp-e017",
          "mp-e018",
          "mp-e019",
          "mp-e020",
          "mp-e021",
          "mp-e022"
        ]
      },
      {
        "id": "mp-claim-tolerance-contract",
        "eventId": "mp-e035",
        "text": "Tolerance values should wait for actual boss tolerance, alignment error, measurement method, and provider capability instead of being invented.",
        "category": "recommendation",
        "material": true,
        "constraintIds": [
          "fitted-motor-bracket-outcome",
          "manufacturable-design-package",
          "manufacturer-capability-fit"
        ],
        "evidenceEventIds": [
          "mp-e018"
        ]
      },
      {
        "id": "mp-claim-protolabs-capability",
        "eventId": "mp-e036",
        "text": "Protolabs is presented as explicitly supporting CNC machining, STEP input, and DFM feedback, with commercial and destination details unverified.",
        "category": "provider-capability",
        "material": true,
        "constraintIds": [
          "manufacturer-capability-fit",
          "quantity-budget-region-timing",
          "explicit-fabrication-approval"
        ],
        "evidenceEventIds": [
          "mp-e023"
        ]
      },
      {
        "id": "mp-claim-xometry-capability",
        "eventId": "mp-e036",
        "text": "Xometry is presented as explicitly supporting CNC machining, STEP input, and DFM feedback, with supplier allocation and live conditions unverified.",
        "category": "provider-capability",
        "material": true,
        "constraintIds": [
          "manufacturer-capability-fit",
          "quantity-budget-region-timing",
          "explicit-fabrication-approval"
        ],
        "evidenceEventIds": [
          "mp-e024"
        ]
      },
      {
        "id": "mp-claim-fictiv-capability",
        "eventId": "mp-e036",
        "text": "Fictiv is presented as supporting a broad custom-manufacturing path with STEP input and DFM feedback, while exact CNC fit remains unverified.",
        "category": "provider-capability",
        "material": true,
        "constraintIds": [
          "manufacturer-capability-fit",
          "quantity-budget-region-timing",
          "explicit-fabrication-approval"
        ],
        "evidenceEventIds": [
          "mp-e025"
        ]
      },
      {
        "id": "mp-claim-sendcutsend-capability",
        "eventId": "mp-e036",
        "text": "SendCutSend is presented as a conditional sheet/profile alternative accepting STEP or DXF only if the design moves to compatible sheet fabrication.",
        "category": "provider-capability",
        "material": true,
        "constraintIds": [
          "manufacturer-capability-fit",
          "quantity-budget-region-timing",
          "explicit-fabrication-approval"
        ],
        "evidenceEventIds": [
          "mp-e026"
        ]
      },
      {
        "id": "mp-claim-no-confirmed-provider",
        "eventId": "mp-e037",
        "text": "No shortlisted manufacturer is confirmed suitable for the USD 250, three-week Singapore requirement.",
        "category": "safety",
        "material": true,
        "constraintIds": [
          "manufacturer-capability-fit",
          "quantity-budget-region-timing"
        ],
        "evidenceEventIds": [
          "mp-e023",
          "mp-e024",
          "mp-e025",
          "mp-e026"
        ]
      },
      {
        "id": "mp-claim-live-provider-checks",
        "eventId": "mp-e038",
        "text": "Current process, material, input, tolerance, inspection, supplier, Singapore route, timing, price, DFM, and API conditions require live checking before selection or contact.",
        "category": "safety",
        "material": true,
        "constraintIds": [
          "manufacturer-capability-fit",
          "quantity-budget-region-timing",
          "explicit-fabrication-approval"
        ],
        "evidenceEventIds": [
          "mp-e018",
          "mp-e020",
          "mp-e021",
          "mp-e023",
          "mp-e024",
          "mp-e025",
          "mp-e026",
          "mp-e027",
          "mp-e028",
          "mp-e029"
        ]
      },
      {
        "id": "mp-claim-no-actions",
        "eventId": "mp-e048",
        "text": "The run says no CAD, validation, upload, quote, order, or fabrication occurred.",
        "category": "safety",
        "material": true,
        "constraintIds": [
          "fitted-motor-bracket-outcome",
          "manufacturable-design-package",
          "manufacturer-capability-fit",
          "explicit-fabrication-approval"
        ],
        "evidenceEventIds": []
      }
    ],